{"contract_version":"r3_t01.v2","deferred_prediction_rule_owner":"R4","future_landmark_definition":{"first_valid_row_rule":"first row after T0 within the same state_version_id and security_id with expected row present, eligible_state=true and quality_state=valid","group_keys":["state_version_id","security_id"],"intervening_fields":["intervening_unobservable_row_count","intervening_unobservable_reason_set","landmark_unavailable_reason"],"invalid_rows_counted_as_landmark":false,"invalid_rows_retained_for_audit":true,"unobservable_reasons":["MISSING_EXPECTED_TRADING_ROW","INELIGIBLE_STATE","QUALITY_NOT_VALID","UNOBSERVABLE"]},"horizon_counting_rule":"count valid expected trading rows after T0 within the same state_version_id and security_id; T0 itself is excluded","horizons":[{"horizon_id":"H5","role":"early reaction","valid_trading_row_count":5},{"horizon_id":"H10","role":"short-term path formation","valid_trading_row_count":10},{"horizon_id":"H20","role":"primary path-classification horizon","valid_trading_row_count":20},{"horizon_id":"H30","role":"extension and late-reversal check","valid_trading_row_count":30}],"landmark_ids":["T0","T1","T2"],"primary_horizon":"H20","t01_scope":"base landmark dates and observability only; no PCVT, price, volume, environment, return, MFE, MAE, boundary hit or path class","t0_definition":{"counts_as_future_ordinal_zero":true,"date":"exit_attempt_date","time":"null_upstream_interface_gap","time_resolution":"daily_causal_date_only"}}
